{
	"_meta": {
		"sources": [
			{
				"json": "StonemoonShop",
				"abbreviation": "StonemoonShop",
				"full": "Stonemoon Shop (collection of my favorite items)",
				"authors": [
					"The community (Roll20,Reddit,Pinterest,...)"
				],
				"convertedBy": [
					"p4535992"
				],
				"version": "1.3.1",
				"url": "",
				"targetSchema": "1.0.0"
			}
		],
		"currencyConversions": {
			"goblincurrency": [
				{
					"coin": "ap",
					"mult": 1
				},
				{
					"coin": "bp",
					"mult": 0.5,
					"isFallback": true
				}
			]
		},
		"dateAdded": 1537874753,
		"dateLastModified": 1537874753
	},
	"itemProperty": [
		{
			"abbreviation": "Spiked",
			"source": "StonemoonShop",
			"entries": [
				{
					"type": "entries",
					"name": "Spiked",
					"entries": [
						"When hit by a weapon with the spiked property the target gains {@dice +1} damage."
					]
				}
			]
		}
	],
	"item": [
		{
			"name": "Spider Staff",
			"baseItem": "staff|PHB",
			"weaponCategory": "martial",
			"weight": 6,
			"dmg1": "1d6",
			"dmg2": "1d6 poison damage",
			"dmgType": "B",
			"property": [
				"H",
				"R",
				"2H"
			],
			"armor": false,
			"ac": "0",
			"stealth": false,
			"rarity": "uncommon",
			"wondrous": false,
			"value": 1000,
			"weapon": true,
			"staff": true,
			"recharge": "dusk",
			"charges": 10,
			"source": "StonemoonShop",
			"entries": [
				"The top of this black, adamantine staff is shaped like a spider. The staff weighs 6 pounds. You must be attuned to the staff to gain its benefits and cast its spells.",
				"The staff can be wielded as a quarterstaff. It deals {@dice 1d6} extra poison damage on a hit when used to make a weapon attack.",
				"The staff has 10 charges, which are used to fuel the spells within it. With the staff in hand, you can use your action to cast one of the following spells from the staff if the spell is on your class's spell list: {@spell spider climb} (1 charge) or {@spell web} (2 charges, spell save DC 15). No components are required.",
				"The staff regains {@dice 1d6 + 4} expended charges each day at dusk. If you expend the staff's last charge, roll a {@dice d20}. On a 1, the staff crumbles to dust and is destroyed."
			],
			"attachedSpells": [
				"spider climb",
				"web"
			],
			"fluff": {
				"images": [
					{
						"type": "image",
						"href": {
							"type": "external",
							"url": "https://i.imgur.com/jrmsk3k.jpg"
						}
					}
				],
				"entries": []
			}
		},
		{
			"name": "Staff of Defense",
			"baseItem": "staff|PHB",
			"weaponCategory": "martial",
			"weight": 3,
			"dmg1": "1d6",
			"dmgType": "B",
			"property": [
				"H",
				"R",
				"2H"
			],
			"armor": false,
			"ac": "0",
			"stealth": false,
			"rarity": "uncommon",
			"wondrous": false,
			"value": 1000,
			"weapon": true,
			"staff": true,
			"recharge": "dawn",
			"charges": 10,
			"source": "StonemoonShop",
			"entries": [
				"This slender, hollow staff is made of glass yet is as strong as oak. It weighs 3 pounds. You must be attuned to the staff to gain its benefits and cast its spells.",
				"While holding the staff, you have a +1 bonus to your Armor Class.",
				"The staff has 10 charges, which are used to fuel the spells within it. With the staff in hand, you can use your action to cast one of the following spells from the staff if the spell is on your class's spell list: {@spell mage armor} (1 charge) or {@spell shield} (2 charges). No components are required.",
				"The staff regains {@dice 1d6 + 4} expended charges each day at dawn. If you expend the staff's last charge, roll a {@dice d20}. On a 1, the staff shatters and is destroyed."
			],
			"bonusAc": "+1",
			"attachedSpells": [
				"mage armor",
				"shield"
			],
			"fluff": {
				"images": [
					{
						"type": "image",
						"href": {
							"type": "external",
							"url": "https://i.imgur.com/G0w2N7F.jpg"
						}
					}
				],
				"entries": []
			}
		},
		{
			"name": "Wand of Magic Missiles",
			"baseItem": "wand|PHB",
			"type": "WD",
			"weaponCategory": "martial",
			"weight": 3,
			"dmg1": "1d6",
			"dmgType": "B",
			"property": [
				"H",
				"R",
				"2H"
			],
			"armor": false,
			"ac": "0",
			"stealth": false,
			"rarity": "uncommon",
			"wondrous": false,
			"value": 1000,
			"weapon": true,
			"wand": true,
			"recharge": "dawn",
			"charges": 7,
			"source": "StonemoonShop",
			"entries": [
				"This wand has 7 charges. With the wand in hand, you can use your action to fire the {@spell magic missile} spell from the wand\u2014no components required\u2014and expend 1 to 3 of the wand's charges. For each charge you expend beyond 1, the spell's level increases by 1. You can use this wand even if you are incapable of casting spells.",
				"The wand regains {@dice 1d6 + 1} expended charges each day at dawn. If you expend the wand's last charge, roll a {@dice d20}. On a 1, the wand crumbles into ash and is destroyed."
			],
			"attachedSpells": [
				"magic missile"
			],
			"fluff": {
				"images": [
					{
						"type": "image",
						"href": {
							"type": "external",
							"url": "https://i.imgur.com/BO612vr.jpg"
						}
					}
				],
				"entries": []
			}
		},
		{
			"name": "Spell Scroll",
			"type": "SC",
			"baseItem": "scroll|PHB",
			"weaponCategory": "",
			"weight": 0,
			"armor": false,
			"ac": "0",
			"stealth": false,
			"rarity": "varies",
			"wondrous": false,
			"value": 1000,
			"weapon": false,
			"source": "StonemoonShop",
			"entries": [
				"A spell scroll bears the words of a single spell, written in a mystical cipher. If the spell is on your class's spell list, you can use an action to read the scroll and cast its spell without having to provide any of the spell's components. Otherwise, the scroll is unintelligible.",
				"If the spell is on your class's spell list but of a higher level than you can normally cast, you must make an ability check using your spellcasting ability to determine whether you cast it successfully. The DC equals 10 + the spell's level. On a failed check, the spell disappears from the scroll with no other effect.",
				"Once the spell is cast, the words on the scroll fade, and the scroll itself crumbles to dust."
			],
			"fluff": {
				"images": [
					{
						"type": "image",
						"href": {
							"type": "external",
							"url": "https://i.imgur.com/DEWU6Me.png"
						}
					}
				],
				"entries": []
			}
		},
		{
			"name": "Ring of Protection",
			"baseItem": "ring|PHB",
			"type": "RG",
			"weaponCategory": "varies",
			"weight": 0,
			"armor": false,
			"ac": "0",
			"stealth": false,
			"rarity": "rare",
			"wondrous": false,
			"reqAttune": true,
			"value": 1000,
			"weapon": false,
			"source": "StonemoonShop",
			"entries": [
				"While you are wearing this ring and are attuned to it, you have a +1 bonus to your Armor Class and saving throws."
			],
			"bonusAc": "+1",
			"bonusSavingThrow": "+1",
			"fluff": {
				"images": [
					{
						"type": "image",
						"href": {
							"type": "external",
							"url": "https://i.imgur.com/29d5Z4Z.jpg"
						}
					}
				],
				"entries": []
			}
		},
		{
			"name": "Boots of Striding and Springing",
			"weaponCategory": "varies",
			"weight": 0,
			"armor": false,
			"ac": "0",
			"stealth": false,
			"rarity": "uncommon",
			"wondrous": true,
			"reqAttune": true,
			"value": 1000,
			"weapon": false,
			"source": "StonemoonShop",
			"entries": [
				"Your speed while you wear these boots becomes 30 feet, unless your walking speed is higher, and your speed is not reduced if you are encumbered or wearing heavy armor. In addition, whenever you jump, you can jump three times the normal distance."
			],
			"fluff": {
				"images": [
					{
						"type": "image",
						"href": {
							"type": "external",
							"url": "https://i.imgur.com/QT2Ubk1.jpg"
						}
					}
				],
				"entries": []
			}
		},
		{
			"name": "Gauntlets of Ogre Power",
			"weaponCategory": "varies",
			"weight": 0,
			"armor": false,
			"ac": "0",
			"stealth": false,
			"rarity": "uncommon",
			"wondrous": true,
			"reqAttune": true,
			"value": 1000,
			"weapon": false,
			"source": "StonemoonShop",
			"entries": [
				"While you wear these gauntlets, your Strength becomes 19. If your Strength is already 19 or higher, the gauntlets have no effect on you."
			],
			"fluff": {
				"images": [
					{
						"type": "image",
						"href": {
							"type": "external",
							"url": "https://i.imgur.com/AgSIiu9.jpg"
						}
					}
				],
				"entries": []
			}
		},
		{
			"name": "Amulet of Proof Against Detection and Location",
			"weaponCategory": "varies",
			"weight": 0,
			"armor": false,
			"ac": "0",
			"stealth": false,
			"rarity": "uncommon",
			"wondrous": true,
			"reqAttune": true,
			"value": 1000,
			"weapon": false,
			"source": "StonemoonShop",
			"entries": [
				"While wearing this amulet, you are hidden from divination magic. You can't be targeted by such magic or perceived through magical scrying sensors."
			],
			"fluff": {
				"images": [
					{
						"type": "image",
						"href": {
							"type": "external",
							"url": "https://i.imgur.com/SkN50to.png"
						}
					}
				],
				"entries": []
			}
		},
		{
			"name": "Spell Scroll of Protection from Energy",
			"baseItem": "scroll|PHB",
			"type": "SC",
			"weaponCategory": "varies",
			"weight": 0,
			"armor": false,
			"ac": "0",
			"stealth": false,
			"rarity": "uncommon",
			"wondrous": false,
			"reqAttune": false,
			"value": 1000,
			"weapon": false,
			"source": "StonemoonShop",
			"entries": [
				"A spell scroll containing the spell {@spell Protection from Energy}.",